[
  {"id":"flan_mixture","name":"FLAN Task Mixture Adapter","taxonomy_categories":["task_assistance_alignment"],"stage":"supervision","implementation_status":"adapter"},
  {"id":"parrot","name":"Parrot Turn Export Adapter","taxonomy_categories":["task_assistance_alignment"],"stage":"supervision","implementation_status":"adapter"},
  {"id":"good_plan","name":"Plan Preference and Utility Analysis","taxonomy_categories":["task_assistance_alignment"],"stage":"assurance","implementation_status":"reference"},
  {"id":"ifeval_pp","name":"IFEval++ Reliability Metric","taxonomy_categories":["task_assistance_alignment"],"stage":"assurance","implementation_status":"reference"},
  {"id":"mosaic","name":"MOSAIC-style Granular Compliance","taxonomy_categories":["task_assistance_alignment"],"stage":"assurance","implementation_status":"reference"},
  {"id":"reasonif","name":"ReasonIF Scoped Compliance","taxonomy_categories":["task_assistance_alignment"],"stage":"assurance","implementation_status":"reference"},
  {"id":"fb_bench","name":"FB-Bench-style Correction Analysis","taxonomy_categories":["task_assistance_alignment"],"stage":"assurance","implementation_status":"reference"},
  {"id":"vpl","name":"VPL Negative ELBO Objective","taxonomy_categories":["personalized_alignment"],"stage":"training","implementation_status":"reference"},
  {"id":"oppu","name":"OPPU Per-user Training Adapter","taxonomy_categories":["personalized_alignment"],"stage":"training","implementation_status":"adapter"},
  {"id":"prism","name":"PRISM Individual Preference Adapter","taxonomy_categories":["personalized_alignment"],"stage":"supervision","implementation_status":"adapter"},
  {"id":"pad","name":"PAD Personalized Decoding Kernel","taxonomy_categories":["personalized_alignment"],"stage":"inference","implementation_status":"reference"},
  {"id":"prose","name":"PROSE Preference Refinement Workflow","taxonomy_categories":["personalized_alignment"],"stage":"specification","implementation_status":"reference"},
  {"id":"fpps","name":"FPPS Hidden-state Steering Kernel","taxonomy_categories":["personalized_alignment"],"stage":"inference","implementation_status":"reference"},
  {"id":"personalized_benchmark","name":"Per-user Elo and Bradley-Terry Benchmark","taxonomy_categories":["personalized_alignment"],"stage":"assurance","implementation_status":"reference"},
  {"id":"interaction_alignment","name":"Interaction-based Explicit Profile Adaptation","taxonomy_categories":["personalized_alignment"],"stage":"specification","implementation_status":"reference"},
  {"id":"distributional_preference","name":"Distributional Preference Likelihoods","taxonomy_categories":["uncertainty_drift"],"stage":"training","implementation_status":"reference"},
  {"id":"active_preference","name":"Active Preference Pair Selection","taxonomy_categories":["uncertainty_drift"],"stage":"supervision","implementation_status":"reference"},
  {"id":"preference_stability","name":"Within-person Retest Stability","taxonomy_categories":["uncertainty_drift"],"stage":"assurance","implementation_status":"reference"},
  {"id":"copr","name":"COPR Fitting and Replay Objectives","taxonomy_categories":["uncertainty_drift"],"stage":"training","implementation_status":"reference"},
  {"id":"moral_change","name":"Moral Preference Change Descriptive Analysis","taxonomy_categories":["uncertainty_drift"],"stage":"assurance","implementation_status":"reference"},
  {"id":"pilaf","name":"PILAF Practical Pair Sampling","taxonomy_categories":["uncertainty_drift"],"stage":"supervision","implementation_status":"reference"},
  {"id":"wdpo","name":"Wasserstein DPO First-order Objective","taxonomy_categories":["uncertainty_drift"],"stage":"training","implementation_status":"reference"},
  {"id":"kldpo","name":"KL-DRO DPO Envelope Objective","taxonomy_categories":["uncertainty_drift"],"stage":"training","implementation_status":"reference"},
  {"id": "human_feedback", "name": "Human Feedback Provider", "taxonomy_categories": ["human_feedback"], "stage": "supervision", "implementation_status": "adapter"},
  {"id": "ai_feedback", "name": "AI Feedback Provider", "taxonomy_categories": ["ai_feedback"], "stage": "supervision", "implementation_status": "adapter"},
  {"id": "human_preferences", "name": "Human Trajectory Preferences (Christiano et al.)", "taxonomy_categories": ["demonstrations_preferences", "human_feedback"], "stage": "supervision", "implementation_status": "adapter"},
  {"id": "summarization_feedback", "name": "Summarization Human Comparisons", "taxonomy_categories": ["demonstrations_preferences", "human_feedback"], "stage": "supervision", "implementation_status": "adapter"},
  {"id": "instructgpt_feedback", "name": "InstructGPT Demonstration and Ranking Interface", "taxonomy_categories": ["demonstrations_preferences", "human_feedback"], "stage": "supervision", "implementation_status": "reference"},
  {"id": "hh_rlhf", "name": "Helpful and Harmless Human Preferences", "taxonomy_categories": ["demonstrations_preferences", "human_feedback"], "stage": "supervision", "implementation_status": "adapter"},
  {"id": "openassistant", "name": "OpenAssistant Conversation Rankings", "taxonomy_categories": ["demonstrations_preferences", "human_feedback"], "stage": "supervision", "implementation_status": "adapter"},
  {"id": "helpsteer2", "name": "HelpSteer2 Human Ratings to Preferences", "taxonomy_categories": ["demonstrations_preferences", "human_feedback"], "stage": "supervision", "implementation_status": "adapter"},
  {"id": "fine_grained_feedback", "name": "Fine-grained Minimal-edit Supervision", "taxonomy_categories": ["human_feedback", "ai_feedback", "demonstrations_preferences"], "stage": "supervision", "implementation_status": "reference"},
  {"id": "rlhf_v", "name": "RLHF-V Correction Dataset Adapter", "taxonomy_categories": ["demonstrations_preferences", "human_feedback"], "stage": "supervision", "implementation_status": "adapter"},
  {"id": "mm_rlhf", "name": "MM-RLHF Multimodal Ranking Adapter", "taxonomy_categories": ["demonstrations_preferences", "human_feedback"], "stage": "supervision", "implementation_status": "adapter"},
  {"id": "wildfeedback", "name": "WildFeedback Normalized Preference Interface", "taxonomy_categories": ["ai_feedback", "human_feedback"], "stage": "supervision", "implementation_status": "reference"},
  {"id": "constitutional_ai", "name": "Constitutional AI Feedback Stages", "taxonomy_categories": ["critique_process_feedback", "ai_feedback"], "stage": "supervision", "implementation_status": "reference"},
  {"id": "rlaif", "name": "RLAIF Soft Preference Labeling", "taxonomy_categories": ["demonstrations_preferences", "ai_feedback"], "stage": "supervision", "implementation_status": "reference"},
  {"id": "self_instruct", "name": "Self-Instruct Bootstrapping", "taxonomy_categories": ["demonstrations_preferences", "ai_feedback"], "stage": "supervision", "implementation_status": "reference"},
  {"id": "ultrafeedback", "name": "UltraFeedback Multi-aspect Preference Adapter", "taxonomy_categories": ["demonstrations_preferences", "ai_feedback"], "stage": "supervision", "implementation_status": "adapter"},
  {"id": "llm_judge", "name": "LLM-as-a-Judge Pairwise Feedback", "taxonomy_categories": ["behavioral_evaluator_evaluation", "ai_feedback"], "stage": "supervision", "implementation_status": "reference"},
  {"id": "g_eval", "name": "G-Eval Probability-weighted Evaluation", "taxonomy_categories": ["behavioral_evaluator_evaluation", "ai_feedback"], "stage": "supervision", "implementation_status": "reference"},
  {"id": "self_rewarding", "name": "Self-Rewarding Iterative Preference Workflow", "taxonomy_categories": ["demonstrations_preferences", "ai_feedback"], "stage": "supervision", "implementation_status": "reference"},
  {"id": "ipo", "name": "Identity Preference Optimization", "taxonomy_categories": ["demonstrations_preferences", "preference_optimization"], "stage": "training", "implementation_status": "native"},
  {"id": "bpo", "name": "Bregman Preference Optimization", "taxonomy_categories": ["demonstrations_preferences", "preference_optimization"], "stage": "training", "implementation_status": "native"},
  {"id": "tdpo", "name": "Token-level Direct Preference Optimization", "taxonomy_categories": ["demonstrations_preferences", "preference_optimization"], "stage": "training", "implementation_status": "native"},
  {"id": "tis_dpo", "name": "Token-level Importance Sampling DPO", "taxonomy_categories": ["demonstrations_preferences", "preference_optimization"], "stage": "training", "implementation_status": "native"},
  {"id": "ti_dpo", "name": "Token-Importance Guided DPO", "taxonomy_categories": ["demonstrations_preferences", "preference_optimization"], "stage": "training", "implementation_status": "native"},
  {"id": "tbpo_q", "name": "Token Bregman Preference Optimization (Q)", "taxonomy_categories": ["demonstrations_preferences", "preference_optimization"], "stage": "training", "implementation_status": "native"},
  {"id": "tbpo_a", "name": "Token Bregman Preference Optimization (A)", "taxonomy_categories": ["demonstrations_preferences", "preference_optimization"], "stage": "training", "implementation_status": "native"},
  {"id": "dpo", "name": "Direct Preference Optimization", "taxonomy_categories": ["demonstrations_preferences", "preference_optimization"], "stage": "training", "implementation_status": "native"},
  {"id": "sft", "name": "Supervised Fine-Tuning", "taxonomy_categories": ["demonstrations_preferences", "supervised_alignment"], "stage": "training", "implementation_status": "native"},
  {"id": "kto", "name": "Kahneman-Tversky Optimization", "taxonomy_categories": ["demonstrations_preferences", "preference_optimization"], "stage": "training", "implementation_status": "native"},
  {"id": "simpo", "name": "Simple Preference Optimization", "taxonomy_categories": ["demonstrations_preferences", "preference_optimization"], "stage": "training", "implementation_status": "native"},